Actual,Predict,Path,Sampling Rate
ដូច្នេះវាធ្វើឲ្យមានរន្ទះបាញ់ ឬមួយក៏អីអញ្ចឹងទៅ វាអាចនឹងឆក់យើង បាទ ហើយរន្ទះបាញ់ នឹងបាញ់យើងមួយរំពេចហ្នឹងតែម្ដង ដូច្នេះ ការបាត់បង់ជីវិតហ្នឹង នឹងមានលក្ខណៈលឿនមែនទែន,ដូចនែកវាធ្វើឲ្យមានរឆ្ទះបាញ់ ឬមួយក៏អីយើងទៅវាអាចនឹងឆក់យើងបាញ់ហើយរឆ្ទះបាញ់ហ្នឹងហ្នឹងបាញ់យើងមួយរំពិកតែម្តង ដូច្នេះការបាត់បង់ជីវុតហ្នឹងមានលក្ខណៈលឿនមែនទែន,8_24.wav,16000
បាទ ហើយមួយទៀតពេលដែលភ្លៀងអញ្ចឹងនៅស្រុកស្រែគឺ វាមិនសូវជាមានថ្នល់ជាតិទេ មានថ្នល់ចាក់កៅស៊ូអីអញ្ចឹងទេ វាមានតែផ្លូវលំ ផ្លូវក្រួសក្រហមអីអញ្ចឹង ផ្លូវភក់ អីអញ្ចឹង បាទ,ហើយមួយទៀតពេលដែលភ្លៀង អញ្ចឹងនៅជ្រុកស្នាគឺវាមិនសូវជាមានថ្នល់ជាទេមានថ្នល់ចត្តទៅសួយអញ្ចឹងទេ វាមានតែផ្លូវលំផ្លូវគ្រោះកហ៊ុមអីអញ្ចឹងផ្លូវផុកអញ្ចឹងអ្ហាណាស់,8_18.wav,16000
ហើយពេលដែលយើងធ្វើដំណើរ  ភក់ហ្នឹងវាខ្ទាត មកប្រឡាក់អាវរបស់យើង ឬមួយក៏ពេលដែលភក់នោះ អញ្ចឹងទៅ ធ្វើឲ្យយើងរអិលដួល,ហើយពេលដែលយើងធ្វើដំណើរអីអញ្ចឹងខ្លាស់អាផុកហ្នឹងវាខ្ទៀតមកប្រឡាក់អាចរបស់យើង ឬមួយក៏ពេលដែលផុកចឹងដោយធ្វើឲ្យយើងល្អិលដួល,8_19.wav,16000
បាទ ដូច្នេះយើង គប្បីយើងពេលដែលភ្លៀង យើងគួរតែនៅផ្ទះ បាទ គប្បីយើងមិនគួរចេញដើរទៅវាលស្រែ,ដូច្នេះយើងគ្រប់បីយើងពេលដែលភ្លៀង យើងគួរទៅនៅផ្ទះ គាប់បីយើងមិនគួរចេញដើរទៅវាស្រែ,8_25.wav,16000
ហើយវាមានប្រដាប់សម្រាប់ចាប់ពីរ គឺ ចាប់មួយបូក គឺចាប់មួយដក,ហើយវាមានសម្រាប់ចាប់ពីរគឺចាប់មួយបូរគឺចាប់មួយដ,8_31.wav,16000
បាទ ហើយអ្នកខ្លះទៀត ពេលដែលទឹកភ្លៀងមក គឺគេបានយកអាគុយរបស់គេ បានយកអាគុយរបស់គេហ្នឹង,ហើយអ្នកខ្លះគៀត ពេលដែលទឹកភ្លៀងមក គេបានយកអគុយរបស់គេ បានយកអគុយរបស់គេហ្នឹង,8_27.wav,16000
បាទ ដូច្នេះគឺខ្ញុំរៀបរាប់បានតែត្រឹមហ្នឹងទេ ដូច្នេះខ្ញុំសូមបញ្ចប់នូវការរៀបរាប់ នូវរដូវទឹកភ្លៀងនៅក្នុងជនបទតែត្រឹមនេះសិន,ដូច្នេះគឺខ្ញុំរៀបរាប់បានដែលត្រឹមដឹងទេ ដូច្នេះខ្ញុំសូមបញ្ចប់នៅការរើបរាប់នៅរដូវទឹកភ្លៀងនៅក្នុងជនុបទត្រឹមសិន,8_33.wav,16000
បាទ ចាប់បូកនោះ គឺពណ៌ក្រហម រីឯចាប់ដកនោះ គឺពណ៌ខ្មៅអីអញ្ចឹងទៅ,បាទចាប់បូកគឺពណ៌វហ្គមរាយចាប់ដកនៅគឺពណ៌ខ្មែរវាអញ្ចឹងទៅ,8_32.wav,16000
ឬមួយក៏ចេញដើរទៅរកខ្យង ឬមួយក៏រកក្ដាមអីទេ បាទព្រោះថាវាធ្វើឲ្យយើងមានគ្រោះថ្នាក់,នៅមួយក៏ចេញដើមតែរកចម្ចរណ៍រកក្ដាមីទេ បានព្រោះថើមវាធ្វើយើងមានគ្រោះថ្នាក់,8_26.wav,16000
នៅជនបទបានន័យថានៅស្រុកស្រែ បាទ ដូច្នេះកុំឲ្យខាតពេលយូរខ្ញុំសូមបកស្រាយ និងរៀបរាប់ដូចតទៅ,នៅជនបទហ្នឹងបន័យថានៅស្រុកស្រែ បាទ តូច្នេះក្រមកខាត់ពេលយូរ ខ្ញុំសូរបកស្រែនឹងរៀបរាប់ដូចតទៅ,8_1.wav,16000
﻿សួស្តីមិត្តភក្តិទាំងអស់គ្នា ជួបជាមួយខ្ញុំម្ដងទៀតហើយក្នុងការនិយាយអំពីរដូវភ្លៀង នៅជនបទម្ដង,សួស្តីមិនផែទាំងអស់គ្នាជាមួយខ្ញុំម្តងទៀតហើយក្នុងការនិយាយអំពីរដូវភ្លាមនៅជនបទម្តង,8_0.wav,16000
នៅជនបទ ពេលដែលមានភ្លៀងម្ដងៗ គឺអ្នកស្រែតែងតែសប្បាយចិត្តទៅនឹងទឹកភ្លៀង,នៅជនបទពេលដែលមានភ្លៀងម្តងៗគឺអ្នកស្រាយតែងតែសប្បាយចិត្តទៅនឹងទឹកភ្លៀង,8_2.wav,16000
បាទ   ព្រោះតែទឹកភ្លៀងនេះ គឺធ្វើឲ្យផលដំណាំរបស់គាត់ ដូចជាការដាំស្រូវ,បាទព្រោះតែទឹកភ្លៀងនេះគឺធ្វើឱ្យផលដំណាំរបស់គាត់ ដូចជាការដើមស្រូវ,8_3.wav,16000
បាទ ដូច្នេះគេអាចទុកទឹកនោះប្រើប្រាស់ បាទ ប្រើប្រាស់ដូចជាការដាំស្ល ដូចជាការដាំទឹកញ៉ាំ និយាយរួមគឺការប្រើប្រាស់ផ្សេងៗតាមតម្រូវការរបស់គេ,ដូច្នេះគេអាចទុកទឹកនោះប្រើប្រាស់ដូចជាការដាំស្លរដូចជាការដាំទឹកញ៉ាំនិយាយរួម ការប្រើប្រាស់ផ្សេងៗតាមតំដូចការបស់គេ,8_7.wav,16000
បាទ ដូចជាពេលភ្លៀងមក គឺគេមានទទឹកសម្រាប់ទ្រ ទនោះ គឺគេដាក់ទពីលើដំបូលផ្ទះ រហូតមកដល់ក្រោម បាទ គឺពេលដែលទឹកភ្លៀងវាហូរមក វាហូរចូលទៅក្នុងពាង,ដូចជាពេលភ្លៀងមក គឺគេមានទោតទឹកសម្រាប់ទ្រ ចឹង គេដាក់តពីលើដំបូលផ្ទះរហូតមកដល់ក្រោម បាទ គឺពេលដែលទឹកភ្លៀងវាហូមក វាហូតចូលទៅក្នុងពាង,8_6.wav,16000
ដូចជាការដាំដំឡូង ដូចជាការដាំល្ង ដូចជាការដាំ ផលដំណាំផ្សេងៗហ្នឹង គឺវាលូតលាស់ គឺវាអំណោយផលបានយ៉ាងល្អ,ដូចជាការដើមដំឡូង ដូចជាការដើមល្ងរ ដូចជាការដើមផលដំណើមបានផ្សេងៗហ្នឹង គឺវាលូតលាស់ គឺវាអំណោយផលបានយ៉ាងល្អ,8_4.wav,16000
បាទ ហើយពេលដែលភ្លៀងម្ដងៗ គឺថាអ្នកស្រុកអ្នកស្រែគឺតែងតែ ទទួលយកទឹកភ្លៀងនោះទុកប្រើប្រាស់,ហើយពេលដែលភ្លៀងម្តងៗគឺថាអ្នកស្រុកអ្នកស្រាយ ទទួលយកទឹកភ្លៀងនោះទុកប្រើប្រាស់,8_5.wav,16000
ហើយអ្នកខ្លះទៀតនោះ ក៏យកទឹកភ្លៀងនោះយកទៅត្រងទុក បាទ ទុករយៈពេល ១០ ថ្ងៃ ឬមួយក៏ ៥ ថ្ងៃ អញ្ចឹងទៅពួកគេយកមកបរិភោគ យកមកផឹក,ហើយអ្នកខ្លះទៀត ហ្នឹងក៏យកទឹកភ្លៀងនោះយកទៅត្រង់ទុករយៈពេល ១០ថ្ងៃរឿងមួយក៏៥ថ្ងៃ យើងទៅបានពួកគេយកមកបង្បូរិភោយកមកផឹកអីច្ហ,8_8.wav,16000
បាទ ហើយភ្លៀង បាទ ពេលដែលភ្លៀងមក គឺស្រូវ អីហ្នឹងគឺវាបានផលល្អ ពីព្រោះអីពេលដែលភ្លៀងមក,ហើយភ្លៀងពេលដែលភ្លៀងមកគឺស្រូវអីហ្នឹង គឺវាបានផលល្អពីព្រោះអីពេលដែលភ្លៀងមក,8_9.wav,16000
បាទ ដូច្នេះរឿងនេះ គឺជារឿងមួយមិនមែនធម្មតាទេ គឺជារឿងកង្វល់របស់ប្រជាជនកម្ពុជាទូទាំងប្រទេស តែម្ដង,ដូច្នេះរឿងនេះគឺជារឿងមួយពន្មែនធម្មតាទេ គឺជារឿងកង្វល របស់ប្រជាជនកម្ពុជាទូទាំងប្រទេតែម្តង,8_17.wav,16000
ហើយគាត់អ្នកខ្លះហ្នឹង គឺមិនបានធ្វើស្រែទេឆ្នាំនេះ រីឯអ្នកខ្លះទៀតហ្នឹងក៏បានធ្វើស្រែ ប៉ុន្តែធ្វើស្រែដោយដីទទេ គឺគ្មានទឹកទាល់តែសោះ,ហើយគាត់អ្នកខ្លះហ្នឹងគឺមិនបានធ្វើស្រែទេ ឆ្នាំនេះរាអ្នកខ្លះទៀត នោះក៏បានធ្វើស្រែ ប៉ុន្តែធ្វើស្រែដោយដីដទៀរ គឺគ្មានទឹកទាល់តែសោះ,8_16.wav,16000
យកទៅត្រងទឹកភ្លៀង ឬមួយក៏យកអាគុយរបស់គេហ្នឹង ទៅលាងទឹកភ្លៀង ឬមួយក៏បើកគម្របទឹកអាស៊ីតហ្នឹង ចាក់ទឹកភ្លៀងចូល,យកទៅត្រង់ទឹកភ្លៀង ឬមួយក៏យកអគុយរបស់គេហ្នឹងយកទៅលាងទឹកភ្លៀងនៅមួយក៏បើករ៉ូបទឹកអាស៊ិកហ្នឹងចាក់ទឹកភ្លៀងចូល,8_28.wav,16000
បាទ ដូចជា ឧទាហរណ៍ ដូចជាឆ្នាំនេះផ្ទាល់ គឺទឹកភ្លៀងនៅកម្ពុជា មិនសូវជាមានទេ  ខ្ញុំគិតថានៅឆ្នាំនេះ នៅប្រទេសកម្ពុជា នឹងខ្វះខាតស្បៀង,ដូចជាឧទហរណ៍ដូចជាឆ្នាំនេះផ្ទាល់ គឺទឹកភ្លៀងនៅកម្ពស្វជា មិនសូវជាមានទេ ដូច្នេះខ្ញុំគិតថានៅឆ្នាំនេះនៅប្រទេសកម្ពស្វជា និងខ្វះខាតស្បៀង,8_14.wav,16000
បានន័យថានឹងខ្វះខាតអាហារ និងខ្វះខាតបាយញ៉ាំ ហើយអង្ករគឺត្រូវតែឡើងថ្លៃ ព្រោះថាឆ្នាំនេះ គឺមិនសូវមានទឹកភ្លៀង ហើយប្រជាពលរដ្ឋ គាត់ក៏បានដឹងអំពីបញ្ហានេះ,បានន័យថានឹងខ្វះខាតអាហារ មិនឹងខ្វះខាតបាយញ៊ាំ ហើយអង្គរ គឺត្រូវតែឡើងថ្លៃ ព្រោះថាឆ្នាំនែកគឺមិនសូវមានទឹកភ្លៀងហើយប្រជាពលរដ្ឋក៏ក៏បានដឹងអំពីបញ្ហានេះ,8_15.wav,16000
ព្រោះថានៅក្នុងទឹកភ្លៀងហ្នឹងវាមានជាតិអាស៊ីតដែរ បាទ ដូច្នេះគេធ្វើឲ្យអាគុយហ្នឹងកាន់ភ្លើងអីអញ្ចឹងទៅ,ព្រោះថានៅក្នុងទឹកភ្លៀងហ្នឹង វាមានជាតិអាស៊ីតដែរ ដូច្នេះក៏គេធ្វើឱ្យអាគុយហ្នឹងកាន់ភ្លើថ្ងៃចឹងទៅ,8_29.wav,16000
ពេលដែលភ្លៀងមកមួយសាទៀត គឺគេចាប់ផ្ដើម បាទ បាចស្រូវ បាចអីអញ្ចឹងទៅ ដើម្បីឲ្យវាហ្នឹងមានសំណាបក្នុងការដក,ពេលដែលភ្លៀងមកមកសារទៀតគឺគេចាប់ផ្តើមបានជ្រៅបាច់អីចឹងទៅ ដើម្បីអោយវាហ្នឹងមានសំណាបក្នុងការដ៏,8_11.wav,16000
ពេលដែលមុនដំបូង ពេលដែលភ្លៀងមក គឺគេភ្ជួររាស់ដី បាទ ភ្ជួររាស់ដី,ពេលដែលមុនដំបូង ពេលដែលភ្លៀងមកគឺគេព្យួររស់ដី,8_10.wav,16000
ពេលដែលសំណាបហ្នឹងល្អហើយ គឺគេបានយកវាហ្នឹងដក ដើម្បីដាំវាពូនក្លាយជាស្រូវ,ពេលដែលសំណាប់រង់ល្អហើយគឺគេបានយកវានឹងដរអីចឹងទៅដើម្បីដាំបីពូនក្លាយជាស្រូវ,8_12.wav,16000
បាទ ហើយបើសិនជាវាល្អ ឬមួយក៏មិនល្អ គឺអាស្រ័យទៅលើទឹកភ្លៀងដែរ,បាទ បើសិនជាវាល្អរូវមួយកុំមិនល្អ គឺអាស័យទៅលើទឹកភ្លៀងណា,8_13.wav,16000
ហើយបន្ទាប់មកទៀតគឺយើងអាចនិយាយអំពីរដូវប្រាំង,ហើយបន្ទាប់ទៀតគឺអាចនិយាយរហូតដូវប្រាំង,4_36.wav,16000
អញ្ចឹងគឺកសិករនៅក្នុងប្រទេសកម្ពុជា គឺគាត់ដឹងពីពេលវេលា ថាតើនៅខែណា នៅពេលណាដែលនឹងមានភ្លៀងធ្លាក់,អញ្ចឹងគឺកសិករក្នុងប្រទេសកម្ពុជា គឺគាត់ដឹងពីពេលវេលាថាតើនៅខែណាណាដែលនឹងមានភ្លេចន្លះ,4_22.wav,16000
ហើយក៏ជាពេលវេលាមួយដែលគាត់នឹងដាំដំណាំដែរ,ហើយគាត់ជាពេលវេលាមួយដែលគាត់ដឹងដាំលំណាមដែរ,4_23.wav,16000
ចំណែករដូវប្រាំងវិញគឺជារដូវមួយដែលមិនមានភ្លៀងធ្លាក់ច្រើនទេគឺ ចាប់ពីខែ,ចប់ប្រែករដូវប្រាំងវិញគឺជារដូវមួយដែលមិនមានភ្លៀងធ្លាក់ច្រើនទេគឺចាប់ពីខាត,4_37.wav,16000
អញ្ចឹងរដូវវស្សា គឺជារដូវមួយដែលកសិករគាត់ ចាប់ផ្ដើមដាំដំណាំ គឺគាត់ចាប់រៀបចំដី រៀបចំចំការរបស់គាត់ ត្រៀមចាំទឹកភ្លៀង,អញ្ចឹងគឺរដូវវសារ គឺជារដូវមួយដែលកសិករគាត់ចាប់ផ្តើមដាំរំណាំ គឺគាត់ចាប់រៀបចំដីរៀបចំចំការណ៍របស់គាត់រឹតចាំទឹកភ្លៀង,4_21.wav,16000
អញ្ចឹងគឺមានភាពកុះករខ្លាំងណាស់ នៅក្នុងទីក្រុង ពីព្រោះមានមនុស្សម្នាជាច្រើនមកមើលពិធីបុណ្យអុំទូក,គឺមានភាពកោះគោលខ្លាំងណាស់នៃក្នុងទីក្រុងពីពួកឱ្យមិនមនុស្សម្នាជាច្រើនមកមើលពិធីបន្អំទូក,4_35.wav,16000
ហើយចូល ពិធីបុណ្យនេះផងដែរ ដូចជាអ្នកនៅតាមទីជនបទ តាមខេត្តគឺគាត់ឡើងមកទីក្រុងដើម្បីមើលពិធីបុណ្យអុំទូកនេះ,ហើយចូលរួបពិធីបទនេះផងដើម្បីដែលអ្នកនៅតាមទាន់ជាតិបទតាមខេត្ត គេគាត់ឡើងម៉ាត់ទីក្រុងដើម្បីមើលពិធីបុណ្យអំទូកនេះ,4_34.wav,16000
អញ្ចឹងដូចជានៅតាមជនបទគឺ អ្នកស្រែចំការ អ្នកដាំដំណាំ កសិករហ្នឹង គឺគាត់រំពឹងទៅលើទឹកភ្លៀង,អញ្ចឹងដូចជានៃតាមជនបទ គឺអ្នកស្រាយចំ្គការ អ្នកដាំលំណាំ កសិករ ហ្នឹងគឺគាត់កំពឹងទៅលើទឹកភ្លៀង,4_20.wav,16000
ដោយសារយើងអត់មានទឹក ប្រព័ន្ធធារាសាស្ត្រ គ្រប់គ្រាន់នោះទេគឺកសិករពឹងផ្អែកសំខាន់ទៅលើទឹកភ្លៀង,ដោយសារយើងអត់មានទឹកប្រព័ន្ធធរាសាស្ត្រគ្រប់គ្រាន់តែទេ គឺកសិករណ៍ពិងបែកសំខាន់ទៅលើទឹកភ្លៀង,4_18.wav,16000
អញ្ចឹងគឺរដូវវស្សា គឺជារដូវដែលសំខាន់ណាស់សម្រាប់កសិករនៅក្នុងប្រទេសកម្ពុជា,អញ្ចឹងគឺ រដូវវសា គឺជារដូវដែលសំខាន់ណាស់សម្រាប់កសិករណ៍នៅក្នុងប្រទេសក។ជា,4_24.wav,16000
ដូចជាទឹកទន្លេ ទឹកទន្លេមេគង្គឡើងខ្លាំង ហើយយើងហៅថាពិធីបុណ្យអុំទូក,ដូចជាទឹកទន្លេៗមេគង់ឡើងខ្លាំង ហើយយើងហ្អត្ថិពិធីបុណ្យអ៊ុំទូ,4_30.wav,16000
ពិធីបុណ្យអុំទូកគឺជាពិធីបុណ្យមួយដែលប្រារព្ធធ្វើពេលដែលមានការប្រកួតប្រណាំងអុំទូក,ពិធីបុណ្យអមទុ គឺជាពិធីមួយដែរ បរិបធ្វើពេលដែលមានការប្រកូតព្រណាំងអមទុ,4_31.wav,16000
ហើយក៏ជារដូវមួយដែលមានតួនាទីសំខាន់ដែរ គឺផ្ដល់ទឹកភ្លៀង ផ្ដល់ទឹកសម្រាប់កសិករ ដោយសារបើសិនជាគ្មានភ្លៀងទេ គឺកសិករមិនអាចដាំដំណាំបាននោះទេ,ហើយគោចជារដូវមួយដែលមានតួនាទីសំខាន់ដែលផ្តល់ទឹកភ្លៀង ផ្តល់ទឹកសម្រាប់កសិករ ដោយសារ បើសិនជាគ្មានភ្លៀងទេគឺកសិករមិនអាចដាំណាំបានអត់ទេ,4_25.wav,16000
អញ្ចឹងគឺរដូវវស្សា គឺសំខាន់សម្រាប់កសិករនៅក្នុងប្រទេសកម្ពុជា,អញ្ចឹងគឺរដូវវស្សាគឺសំខាន់សម្រាប់កសិករនៅក្នុងប្រទេសកម្ពុជា,4_19.wav,16000
អញ្ចឹងយើងហៅថាពិធីបុណ្យអុំទូក ហើយជា  ពេលវេលាមួយដែលមានផ្ដល់ឱកាសដល់អ្នកផ្សេងៗ អ្នករស់នៅក្នុងប្រទេសកម្ពុជា ការសម្រាកហើយលំហែ,អញ្ចឹងវាខោហ្អតែពិធីបុណ្យអំទូ ហើយជាពេលវេលាមួយដែលមានប្រឡើកាសដល់អ្នកផ្សេងៗអ្នកនៃរស់នៅក្រុមប្រទេសការព្យានឹងការសម្រាកហើយលំហា,4_33.wav,16000
ហើយនៅក្នុងរដូវវស្សា បើយើងក្រឡេកមើលទៅ គឺយើងឃើញថាគឺមានរដូវ គឺជារដូវមួយដែលគេមានប្រារព្ធពិធីបុណ្យដែរ,ហើយនៅក្នុងរដូវវសាបើយើងក្រឡេកមើលទៅគឺយើងឃើញថាគឺមានរដូវ គឺជារដូវមួយដែរ គេមានប្រាក់របស់ពិធីប័នដែរ,4_27.wav,16000
ហើយកសិករគឺពឹងផ្អែកទៅលើទឹកភ្លៀងទាំងស្រុងតែម្ដងក្នុងការដែលធ្វើចំការ ក្នុងការដែលដាំដំណាំ,ហើយកសិករគឺពើអាចទៅលើទឹកភ្លៀងទាំងស្រុងមកដុសការដែលធ្វើចំព្វការណ៍និងការដែលដាំដំណាម,4_26.wav,16000
ដូចជាយើងមានទូកចែវ ឬក៏ទូកអុំហ្នឹង គឺយើងប្រណាំងគ្នា គឺអ្នកដែលមកពីខេត្តផ្សេងៗហ្នឹង គឺទៅប្រកួតប្រណាំងនៅទីក្រុង នៅក្នុងទីក្រុងភ្នំពេញ,ដូចជាយើងមានទូកចារ្យ ឬក៏ទូកអំហ្នឹង គឺយើងប្រណាំគ្នាគឺអ្នកដែលមកពីខែបផ្សេងៗហ្នឹង ទៅប្រកួតប្រណាំងនៅទីក្រុងៗប្រកុំពេញ,4_32.wav,16000
